{
  "$schema": "https://raw.githubusercontent.com/strozynskiw/bonsai/master/release/soak/rc-soak.schema.json",
  "schema_version": 1,
  "release": {
    "tag": "v0.0.0-rc.0",
    "peeled_commit": "0000000000000000000000000000000000000000",
    "manifest_sha256": "0000000000000000000000000000000000000000000000000000000000000000",
    "binary_sha256_by_target": {
      "x86_64-unknown-linux-gnu": "0000000000000000000000000000000000000000000000000000000000000000",
      "aarch64-unknown-linux-gnu": "0000000000000000000000000000000000000000000000000000000000000000",
      "aarch64-apple-darwin": "0000000000000000000000000000000000000000000000000000000000000000",
      "x86_64-apple-darwin": "0000000000000000000000000000000000000000000000000000000000000000"
    },
    "performance_report_sha256_by_target": {
      "x86_64-unknown-linux-gnu": "0000000000000000000000000000000000000000000000000000000000000000",
      "aarch64-unknown-linux-gnu": "0000000000000000000000000000000000000000000000000000000000000000",
      "aarch64-apple-darwin": "0000000000000000000000000000000000000000000000000000000000000000",
      "x86_64-apple-darwin": "0000000000000000000000000000000000000000000000000000000000000000"
    }
  },
  "soak": {
    "started_at": "1970-01-01T00:00:00Z",
    "minimum_hours": 336
  },
  "observations": [],
  "incidents": []
}
